{
  "schemaVersion": "1.0",
  "traceVersion": "0.1.0",
  "repository": {
    "id": "repository:.",
    "name": "swift",
    "root": "/Users/hieudoan/git/github.com/hieudoanm/trace/crates/trace-cli/../../fixtures/swift",
    "fileCount": 5,
    "languageCount": 13
  },
  "analysis": {
    "format": "json",
    "cacheEnabled": true,
    "semanticMode": "off",
    "languages": []
  },
  "languages": [
    {
      "language": "typescript",
      "grammar": "tree-sitter-typescript 0.23.2"
    },
    {
      "language": "tsx",
      "grammar": "tree-sitter-typescript 0.23.2"
    },
    {
      "language": "javascript",
      "grammar": "tree-sitter-javascript 0.25.0"
    },
    {
      "language": "jsx",
      "grammar": "tree-sitter-javascript 0.25.0"
    },
    {
      "language": "python",
      "grammar": "tree-sitter-python 0.25.0"
    },
    {
      "language": "go",
      "grammar": "tree-sitter-go 0.25.0"
    },
    {
      "language": "rust",
      "grammar": "tree-sitter-rust 0.24.2"
    },
    {
      "language": "kotlin",
      "grammar": "tree-sitter-kt 0.1.0"
    },
    {
      "language": "swift",
      "grammar": "tree-sitter-swift 0.7.4"
    },
    {
      "language": "java",
      "grammar": "tree-sitter-java 0.23.5"
    },
    {
      "language": "csharp",
      "grammar": "tree-sitter-c-sharp 0.23.1"
    },
    {
      "language": "php",
      "grammar": "tree-sitter-php 0.23.11"
    },
    {
      "language": "ruby",
      "grammar": "tree-sitter-ruby 0.23.1"
    }
  ],
  "frameworks": [],
  "nodes": [
    {
      "id": "class:src/Complex.swift::Circle",
      "kind": "class",
      "name": "Circle",
      "qualifiedName": "Circle",
      "file": "src/Complex.swift",
      "range": {
        "start": {
          "line": 2,
          "column": 1,
          "byte": 41
        },
        "end": {
          "line": 2,
          "column": 78,
          "byte": 118
        }
      },
      "language": "swift",
      "parent": "module:src/Complex.swift",
      "exported": false
    },
    {
      "id": "class:src/Service.swift::InMemoryRepository",
      "kind": "class",
      "name": "InMemoryRepository",
      "qualifiedName": "InMemoryRepository",
      "file": "src/Service.swift",
      "range": {
        "start": {
          "line": 1,
          "column": 1,
          "byte": 0
        },
        "end": {
          "line": 9,
          "column": 2,
          "byte": 201
        }
      },
      "language": "swift",
      "parent": "module:src/Service.swift",
      "exported": false
    },
    {
      "id": "class:src/Service.swift::ShapeService",
      "kind": "class",
      "name": "ShapeService",
      "qualifiedName": "ShapeService",
      "file": "src/Service.swift",
      "range": {
        "start": {
          "line": 11,
          "column": 1,
          "byte": 203
        },
        "end": {
          "line": 24,
          "column": 2,
          "byte": 513
        }
      },
      "language": "swift",
      "parent": "module:src/Service.swift",
      "exported": false
    },
    {
      "id": "class:src/shapes.swift::Circle",
      "kind": "class",
      "name": "Circle",
      "qualifiedName": "Circle",
      "file": "src/shapes.swift",
      "range": {
        "start": {
          "line": 10,
          "column": 1,
          "byte": 189
        },
        "end": {
          "line": 24,
          "column": 2,
          "byte": 443
        }
      },
      "language": "swift",
      "parent": "module:src/shapes.swift",
      "exported": false
    },
    {
      "id": "class:src/shapes.swift::Rectangle",
      "kind": "class",
      "name": "Rectangle",
      "qualifiedName": "Rectangle",
      "file": "src/shapes.swift",
      "range": {
        "start": {
          "line": 27,
          "column": 1,
          "byte": 504
        },
        "end": {
          "line": 43,
          "column": 2,
          "byte": 822
        }
      },
      "language": "swift",
      "parent": "module:src/shapes.swift",
      "exported": false
    },
    {
      "id": "class:src/shapes.swift::Square",
      "kind": "class",
      "name": "Square",
      "qualifiedName": "Square",
      "file": "src/shapes.swift",
      "range": {
        "start": {
          "line": 46,
          "column": 1,
          "byte": 867
        },
        "end": {
          "line": 60,
          "column": 2,
          "byte": 1095
        }
      },
      "language": "swift",
      "parent": "module:src/shapes.swift",
      "exported": false
    },
    {
      "id": "constant:src/main.swift::shapes",
      "kind": "constant",
      "name": "shapes",
      "qualifiedName": "shapes",
      "file": "src/main.swift",
      "range": {
        "start": {
          "line": 3,
          "column": 1,
          "byte": 19
        },
        "end": {
          "line": 6,
          "column": 2,
          "byte": 113
        }
      },
      "language": "swift",
      "parent": "module:src/main.swift",
      "exported": false
    },
    {
      "id": "constant:src/main.swift::total",
      "kind": "constant",
      "name": "total",
      "qualifiedName": "total",
      "file": "src/main.swift",
      "range": {
        "start": {
          "line": 8,
          "column": 1,
          "byte": 115
        },
        "end": {
          "line": 8,
          "column": 50,
          "byte": 164
        }
      },
      "language": "swift",
      "parent": "module:src/main.swift",
      "exported": false
    },
    {
      "id": "constructor:src/Service.swift::ShapeService.init",
      "kind": "constructor",
      "name": "init",
      "qualifiedName": "ShapeService.init",
      "file": "src/Service.swift",
      "range": {
        "start": {
          "line": 14,
          "column": 5,
          "byte": 270
        },
        "end": {
          "line": 16,
          "column": 6,
          "byte": 341
        }
      },
      "language": "swift",
      "parent": "class:src/Service.swift::ShapeService",
      "exported": false
    },
    {
      "id": "constructor:src/shapes.swift::Circle.init",
      "kind": "constructor",
      "name": "init",
      "qualifiedName": "Circle.init",
      "file": "src/shapes.swift",
      "range": {
        "start": {
          "line": 13,
          "column": 5,
          "byte": 240
        },
        "end": {
          "line": 15,
          "column": 6,
          "byte": 297
        }
      },
      "language": "swift",
      "parent": "class:src/shapes.swift::Circle",
      "exported": false
    },
    {
      "id": "constructor:src/shapes.swift::Rectangle.init",
      "kind": "constructor",
      "name": "init",
      "qualifiedName": "Rectangle.init",
      "file": "src/shapes.swift",
      "range": {
        "start": {
          "line": 31,
          "column": 5,
          "byte": 580
        },
        "end": {
          "line": 34,
          "column": 6,
          "byte": 679
        }
      },
      "language": "swift",
      "parent": "class:src/shapes.swift::Rectangle",
      "exported": false
    },
    {
      "id": "constructor:src/shapes.swift::Square.init",
      "kind": "constructor",
      "name": "init",
      "qualifiedName": "Square.init",
      "file": "src/shapes.swift",
      "range": {
        "start": {
          "line": 49,
          "column": 5,
          "byte": 916
        },
        "end": {
          "line": 51,
          "column": 6,
          "byte": 967
        }
      },
      "language": "swift",
      "parent": "class:src/shapes.swift::Square",
      "exported": false
    },
    {
      "id": "external:swift:ShapeService",
      "kind": "external_symbol",
      "name": "ShapeService",
      "language": "swift"
    },
    {
      "id": "external:swift:String",
      "kind": "external_symbol",
      "name": "String",
      "language": "swift"
    },
    {
      "id": "external:unknown:Foundation",
      "kind": "external_symbol",
      "name": "Foundation",
      "language": "swift"
    },
    {
      "id": "file:src/Complex.swift",
      "kind": "file",
      "name": "src/Complex.swift",
      "file": "src/Complex.swift",
      "language": "swift"
    },
    {
      "id": "file:src/Service.swift",
      "kind": "file",
      "name": "src/Service.swift",
      "file": "src/Service.swift",
      "language": "swift"
    },
    {
      "id": "file:src/main.swift",
      "kind": "file",
      "name": "src/main.swift",
      "file": "src/main.swift",
      "language": "swift"
    },
    {
      "id": "file:src/shapes.swift",
      "kind": "file",
      "name": "src/shapes.swift",
      "file": "src/shapes.swift",
      "language": "swift"
    },
    {
      "id": "file:src/utils.swift",
      "kind": "file",
      "name": "src/utils.swift",
      "file": "src/utils.swift",
      "language": "swift"
    },
    {
      "id": "function:src/Complex.swift::total",
      "kind": "function",
      "name": "total",
      "qualifiedName": "total",
      "file": "src/Complex.swift",
      "range": {
        "start": {
          "line": 3,
          "column": 1,
          "byte": 119
        },
        "end": {
          "line": 3,
          "column": 80,
          "byte": 198
        }
      },
      "language": "swift",
      "parent": "module:src/Complex.swift",
      "exported": false
    },
    {
      "id": "function:src/Service.swift::createService",
      "kind": "function",
      "name": "createService",
      "qualifiedName": "createService",
      "file": "src/Service.swift",
      "range": {
        "start": {
          "line": 26,
          "column": 1,
          "byte": 515
        },
        "end": {
          "line": 28,
          "column": 2,
          "byte": 615
        }
      },
      "language": "swift",
      "parent": "module:src/Service.swift",
      "exported": false
    },
    {
      "id": "function:src/shapes.swift::totalArea",
      "kind": "function",
      "name": "totalArea",
      "qualifiedName": "totalArea",
      "file": "src/shapes.swift",
      "range": {